{
  "case_id": "login_hello_clientbound_framed_dispatch",
  "protocol_version": 775,
  "minecraft_version": "26.1.2",
  "corridor": "Handshake -> Login -> Configuration",
  "oracle_kind": "codec",
  "official_sources": [
    {
      "role": "client_jar",
      "path": "_analysis/minecraft-26.1.2/client.jar",
      "function_or_member": "net.minecraft.network.protocol.login.ClientboundHelloPacket(String, byte[], byte[], boolean)",
      "authority_note": "Official binary source for constructing the smallest Login clientbound hello packet fixture without initialized crypto state."
    },
    {
      "role": "client_jar",
      "path": "_analysis/minecraft-26.1.2/client.jar",
      "function_or_member": "net.minecraft.network.protocol.login.ClientboundHelloPacket.STREAM_CODEC.encode(...)",
      "authority_note": "Official binary source for Login clientbound hello packet body encoding."
    },
    {
      "role": "client_jar",
      "path": "_analysis/minecraft-26.1.2/client.jar",
      "function_or_member": "net.minecraft.network.protocol.login.LoginProtocols.CLIENTBOUND.codec().encode(ClientboundHelloPacket)",
      "authority_note": "Official binary source for Login clientbound hello framed packet encoding."
    },
    {
      "role": "client_jar",
      "path": "_analysis/minecraft-26.1.2/client.jar",
      "function_or_member": "net.minecraft.network.protocol.login.LoginProtocols.CLIENTBOUND.codec().decode(...)",
      "authority_note": "Official binary source for Login clientbound hello framed packet dispatch/decode."
    },
    {
      "role": "client_jar",
      "path": "_analysis/minecraft-26.1.2/client.jar",
      "function_or_member": "net.minecraft.network.protocol.login.LoginProtocols.CLIENTBOUND_TEMPLATE.details().listPackets(...)",
      "authority_note": "Official binary source for the Login clientbound packet table."
    },
    {
      "role": "client_jar",
      "path": "_analysis/minecraft-26.1.2/client.jar",
      "function_or_member": "ClientboundHelloPacket.getServerId(), getChallenge(), shouldAuthenticate(), private publicKey field, ClientLoginPacketListener.handleHello(ClientboundHelloPacket)",
      "authority_note": "Official binary source for reading decoded hello fields and confirming the Login listener clientbound surface."
    }
  ],
  "question": {
    "state": "Login",
    "flow": "Clientbound",
    "packet_type": "minecraft:hello",
    "packet_class": "ClientboundHelloPacket",
    "input_fields": {
      "server_id": "",
      "public_key_hex": "",
      "challenge_hex": "",
      "should_authenticate": false
    },
    "field_notes": {
      "server_id": "Smallest String accepted by the official readUtf(20)/writeUtf codec.",
      "public_key_hex": "Smallest byte array accepted by the official STREAM_CODEC without calling getPublicKey().",
      "challenge_hex": "Smallest byte array accepted by the official STREAM_CODEC without initialized login crypto state.",
      "should_authenticate": "False fixture accepted by the official ClientboundHelloPacket constructor and STREAM_CODEC."
    }
  },
  "answer_path": "oracle/answers/775/login_hello_clientbound_framed_dispatch.answer.jsonl",
  "stop_boundary": "Proves Login clientbound hello packet framing and dispatch/decode for one official empty serverId/publicKey/challenge and shouldAuthenticate=false fixture only; do not infer encryption success, authentication success, key validation, login state transition handling, Configuration entry, Play readiness, or client-load completion."
}
