{
  "case_id": "play_set_default_spawn_position_clientbound_framed_dispatch",
  "protocol_version": 775,
  "minecraft_version": "26.1.2",
  "corridor": "Play",
  "oracle_kind": "codec",
  "official_sources": [
    {
      "role": "client_jar",
      "path": "_analysis/minecraft-26.1.2/client.jar",
      "function_or_member": "ClientboundSetDefaultSpawnPositionPacket(LevelData.RespawnData.DEFAULT), LevelData.RespawnData.STREAM_CODEC",
      "authority_note": "Official binary source for the scoped default spawn body."
    },
    {
      "role": "client_jar",
      "path": "_analysis/minecraft-26.1.2/client.jar",
      "function_or_member": "GameProtocols.CLIENTBOUND_TEMPLATE.details().listPackets(...)",
      "authority_note": "Official binary source for the Play clientbound packet table and set_default_spawn_position packet id."
    }
  ],
  "question": {
    "state": "Play",
    "flow": "Clientbound",
    "packet_type": "minecraft:set_default_spawn_position",
    "packet_class": "ClientboundSetDefaultSpawnPositionPacket",
    "input_fields": {
      "fixture": "LevelData.RespawnData.DEFAULT"
    },
    "field_notes": {
      "scope": "Default overworld zero BlockPos, yaw, and pitch fixture only."
    }
  },
  "answer_path": "oracle/answers/775/play_set_default_spawn_position_clientbound_framed_dispatch.answer.jsonl",
  "stop_boundary": "Proves Play clientbound set_default_spawn_position packet framing and dispatch/decode for LevelData.RespawnData.DEFAULT only; does not infer respawn, compass, world, or player state behavior."
}
