{
  "case_id": "configuration_resource_pack_push_clientbound_framed_dispatch",
  "protocol_version": 775,
  "minecraft_version": "26.1.2",
  "corridor": "Login -> Configuration -> Play",
  "oracle_kind": "codec",
  "official_sources": [
    {
      "role": "client_jar",
      "path": "_analysis/minecraft-26.1.2/client.jar",
      "function_or_member": "net.minecraft.network.protocol.common.ClientboundResourcePackPushPacket(UUID, String, String, boolean, Optional<Component>)",
      "authority_note": "Official binary source for constructing the Configuration clientbound resource_pack_push packet fixture."
    },
    {
      "role": "client_jar",
      "path": "_analysis/minecraft-26.1.2/client.jar",
      "function_or_member": "net.minecraft.network.protocol.common.ClientboundResourcePackPushPacket.STREAM_CODEC",
      "authority_note": "Official binary source for Configuration clientbound resource_pack_push body encoding and decoding."
    },
    {
      "role": "client_jar",
      "path": "_analysis/minecraft-26.1.2/client.jar",
      "function_or_member": "net.minecraft.network.protocol.configuration.ConfigurationProtocols.CLIENTBOUND.codec().encode(ClientboundResourcePackPushPacket)",
      "authority_note": "Official binary source for Configuration clientbound resource_pack_push framed packet encoding."
    },
    {
      "role": "client_jar",
      "path": "_analysis/minecraft-26.1.2/client.jar",
      "function_or_member": "net.minecraft.network.protocol.configuration.ConfigurationProtocols.CLIENTBOUND.codec().decode(...)",
      "authority_note": "Official binary source for Configuration clientbound resource_pack_push framed packet dispatch/decode."
    },
    {
      "role": "client_jar",
      "path": "_analysis/minecraft-26.1.2/client.jar",
      "function_or_member": "net.minecraft.network.protocol.configuration.ConfigurationProtocols.CLIENTBOUND_TEMPLATE.details().listPackets(...)",
      "authority_note": "Official binary source for the Configuration clientbound packet table."
    },
    {
      "role": "client_jar",
      "path": "_analysis/minecraft-26.1.2/client.jar",
      "function_or_member": "net.minecraft.network.protocol.common.ClientboundResourcePackPushPacket.id(), url(), hash(), required(), prompt()",
      "authority_note": "Official binary source for reading decoded resource_pack_push fields."
    }
  ],
  "question": {
    "state": "Configuration",
    "flow": "Clientbound",
    "packet_type": "minecraft:resource_pack_push",
    "packet_class": "ClientboundResourcePackPushPacket",
    "input_fields": {
      "id": "123e4567-e89b-12d3-a456-426614174001",
      "url": "https://example.invalid/rustmine-oracle-pack.zip",
      "hash": "0123456789abcdef0123456789abcdef01234567",
      "required": false,
      "prompt": null
    },
    "field_notes": {
      "prompt": "The fixture uses Optional.empty() so the packet-support proof does not expand into prompt Component rendering, UI behavior, download, reload, or pack application."
    }
  },
  "answer_path": "oracle/answers/775/configuration_resource_pack_push_clientbound_framed_dispatch.answer.jsonl",
  "stop_boundary": "Proves Configuration clientbound resource_pack_push packet framing and dispatch/decode for one official no-prompt fixture only; do not infer resource-pack UI behavior, pack download/reload/application behavior, Configuration completion, Play entry, world load, render readiness, or runtime behavior."
}
