{
  "case_id": "play_hurt_animation_clientbound_framed_dispatch",
  "protocol_version": 775,
  "minecraft_version": "26.1.2",
  "corridor": "Configuration -> Play",
  "oracle_kind": "codec",
  "official_sources": [
    {
      "role": "client_jar",
      "path": "_analysis/minecraft-26.1.2/client.jar",
      "function_or_member": "net.minecraft.network.protocol.game.ClientboundHurtAnimationPacket(int, float)",
      "authority_note": "Official binary source for constructing the Play clientbound hurt_animation packet fixture."
    },
    {
      "role": "client_jar",
      "path": "_analysis/minecraft-26.1.2/client.jar",
      "function_or_member": "net.minecraft.network.protocol.game.ClientboundHurtAnimationPacket.STREAM_CODEC",
      "authority_note": "Official binary source for the Play clientbound hurt_animation packet body codec."
    },
    {
      "role": "client_jar",
      "path": "_analysis/minecraft-26.1.2/client.jar",
      "function_or_member": "net.minecraft.network.protocol.game.GameProtocols.CLIENTBOUND_TEMPLATE.details().listPackets(...)",
      "authority_note": "Official binary source for the Play clientbound packet table and hurt_animation packet id."
    },
    {
      "role": "client_jar",
      "path": "_analysis/minecraft-26.1.2/client.jar",
      "function_or_member": "net.minecraft.network.protocol.game.GameProtocols.CLIENTBOUND_TEMPLATE.bind(RegistryFriendlyByteBuf.decorator(RegistryAccess.EMPTY)).codec().encode/decode(ClientboundHurtAnimationPacket)",
      "authority_note": "Official binary source for Play clientbound hurt_animation framed packet encode and dispatch/decode."
    }
  ],
  "question": {
    "state": "Play",
    "flow": "Clientbound",
    "packet_type": "minecraft:hurt_animation",
    "packet_class": "ClientboundHurtAnimationPacket",
    "input_fields": {
      "entity_id": 123,
      "yaw": 45.5
    },
    "field_notes": {
      "entity_id": "Primitive VarInt fixture; does not prove entity existence.",
      "yaw": "Primitive float fixture."
    }
  },
  "answer_path": "oracle/answers/775/play_hurt_animation_clientbound_framed_dispatch.answer.jsonl",
  "stop_boundary": "Proves Play clientbound hurt_animation packet framing and dispatch/decode for one primitive entity id/yaw fixture only; do not infer entity existence, hurt animation semantics, world state, render readiness, or client-load completion."
}
