{
  "case_id": "play_forget_level_chunk_clientbound_framed_dispatch",
  "protocol_version": 775,
  "minecraft_version": "26.1.2",
  "corridor": "Configuration -> Play",
  "oracle_kind": "codec",
  "official_sources": [
    {
      "role": "client_jar",
      "path": "_analysis/minecraft-26.1.2/client.jar",
      "function_or_member": "net.minecraft.world.level.ChunkPos(int, int)",
      "authority_note": "Official binary source for constructing the chunk position fixture."
    },
    {
      "role": "client_jar",
      "path": "_analysis/minecraft-26.1.2/client.jar",
      "function_or_member": "net.minecraft.network.protocol.game.ClientboundForgetLevelChunkPacket(ChunkPos)",
      "authority_note": "Official binary source for constructing the Play clientbound forget_level_chunk packet fixture."
    },
    {
      "role": "client_jar",
      "path": "_analysis/minecraft-26.1.2/client.jar",
      "function_or_member": "net.minecraft.network.protocol.game.ClientboundForgetLevelChunkPacket.STREAM_CODEC",
      "authority_note": "Official binary source for the Play clientbound forget_level_chunk packet body codec."
    },
    {
      "role": "client_jar",
      "path": "_analysis/minecraft-26.1.2/client.jar",
      "function_or_member": "net.minecraft.network.protocol.game.GameProtocols.CLIENTBOUND_TEMPLATE.details().listPackets(...)",
      "authority_note": "Official binary source for the Play clientbound packet table and forget_level_chunk packet id."
    },
    {
      "role": "client_jar",
      "path": "_analysis/minecraft-26.1.2/client.jar",
      "function_or_member": "net.minecraft.network.protocol.game.GameProtocols.CLIENTBOUND_TEMPLATE.bind(RegistryFriendlyByteBuf.decorator(RegistryAccess.EMPTY)).codec().encode/decode(ClientboundForgetLevelChunkPacket)",
      "authority_note": "Official binary source for Play clientbound forget_level_chunk framed packet encode and dispatch/decode."
    }
  ],
  "question": {
    "state": "Play",
    "flow": "Clientbound",
    "packet_type": "minecraft:forget_level_chunk",
    "packet_class": "ClientboundForgetLevelChunkPacket",
    "input_fields": {
      "chunk_x": 12,
      "chunk_z": -7
    },
    "field_notes": {
      "chunk_pos": "ChunkPos primitive fixture accepted by ClientboundForgetLevelChunkPacket without initialized world or chunk storage."
    }
  },
  "answer_path": "oracle/answers/775/play_forget_level_chunk_clientbound_framed_dispatch.answer.jsonl",
  "stop_boundary": "Proves Play clientbound forget_level_chunk packet framing and dispatch/decode for one ChunkPos fixture only; do not infer chunk unload behavior, client world state, world load, render readiness, or client-load completion."
}
