{
  "case_id": "play_set_entity_motion_clientbound_framed_dispatch",
  "protocol_version": 775,
  "minecraft_version": "26.1.2",
  "corridor": "Configuration -> Play",
  "oracle_kind": "codec",
  "official_sources": [
    {
      "role": "client_jar",
      "path": "_analysis/minecraft-26.1.2/client.jar",
      "function_or_member": "ClientboundSetEntityMotionPacket(int, Vec3)",
      "authority_note": "Official binary source for constructing the Play clientbound set_entity_motion fixture."
    },
    {
      "role": "client_jar",
      "path": "_analysis/minecraft-26.1.2/client.jar",
      "function_or_member": "ClientboundSetEntityMotionPacket.STREAM_CODEC; ByteBufCodecs.VAR_INT; Vec3.LP_STREAM_CODEC",
      "authority_note": "Official binary source for entity id plus low-precision Vec3 movement body codec."
    },
    {
      "role": "client_jar",
      "path": "_analysis/minecraft-26.1.2/client.jar",
      "function_or_member": "GameProtocols.CLIENTBOUND_TEMPLATE.details().listPackets(...)",
      "authority_note": "Official binary source for the Play clientbound packet table and set_entity_motion packet id."
    }
  ],
  "question": {
    "state": "Play",
    "flow": "Clientbound",
    "packet_type": "minecraft:set_entity_motion",
    "packet_class": "ClientboundSetEntityMotionPacket",
    "input_fields": {
      "entity_id": 12345,
      "movement_x": 1.25,
      "movement_y": -0.5,
      "movement_z": 0.125
    },
    "field_notes": {
      "entity_id": "Primitive entity id fixture; does not prove entity existence.",
      "movement": "Primitive Vec3 movement fixture encoded by official Vec3.LP_STREAM_CODEC; does not prove runtime movement application."
    }
  },
  "answer_path": "oracle/answers/775/play_set_entity_motion_clientbound_framed_dispatch.answer.jsonl",
  "stop_boundary": "Proves Play clientbound set_entity_motion packet framing and dispatch/decode for one primitive entity id plus movement fixture only; do not infer entity existence, movement semantics, world state, render readiness, or client-load completion."
}
