{
  "case_id": "play_entity_position_sync_clientbound_framed_dispatch",
  "protocol_version": 775,
  "minecraft_version": "26.1.2",
  "corridor": "Configuration -> Play",
  "oracle_kind": "codec",
  "official_sources": [
    {
      "role": "client_jar",
      "path": "_analysis/minecraft-26.1.2/client.jar",
      "function_or_member": "net.minecraft.network.protocol.game.ClientboundEntityPositionSyncPacket(int, PositionMoveRotation, boolean)",
      "authority_note": "Official binary source for constructing the Play clientbound entity_position_sync packet fixture."
    },
    {
      "role": "client_jar",
      "path": "_analysis/minecraft-26.1.2/client.jar",
      "function_or_member": "net.minecraft.network.protocol.game.ClientboundEntityPositionSyncPacket.STREAM_CODEC",
      "authority_note": "Official binary source for the Play clientbound entity_position_sync packet body codec."
    },
    {
      "role": "client_jar",
      "path": "_analysis/minecraft-26.1.2/client.jar",
      "function_or_member": "net.minecraft.network.protocol.game.GameProtocols.CLIENTBOUND_TEMPLATE.details().listPackets(...)",
      "authority_note": "Official binary source for the Play clientbound packet table and entity_position_sync packet id."
    },
    {
      "role": "client_jar",
      "path": "_analysis/minecraft-26.1.2/client.jar",
      "function_or_member": "net.minecraft.network.protocol.game.GameProtocols.CLIENTBOUND_TEMPLATE.bind(RegistryFriendlyByteBuf.decorator(RegistryAccess.EMPTY)).codec().encode/decode(ClientboundEntityPositionSyncPacket)",
      "authority_note": "Official binary source for Play clientbound entity_position_sync framed packet encode and dispatch/decode."
    }
  ],
  "question": {
    "state": "Play",
    "flow": "Clientbound",
    "packet_type": "minecraft:entity_position_sync",
    "packet_class": "ClientboundEntityPositionSyncPacket",
    "input_fields": {
      "entity_id": 123,
      "x": 1.25,
      "y": 64.5,
      "z": -2.75,
      "delta_x": 0.125,
      "delta_y": 0.0,
      "delta_z": -0.25,
      "y_rot": 45.0,
      "x_rot": -10.0,
      "on_ground": true
    },
    "field_notes": {
      "entity_id": "Primitive VarInt fixture; does not prove entity existence.",
      "values": "PositionMoveRotation constructor fixture; does not call ClientboundEntityPositionSyncPacket.of(Entity)."
    }
  },
  "answer_path": "oracle/answers/775/play_entity_position_sync_clientbound_framed_dispatch.answer.jsonl",
  "stop_boundary": "Proves Play clientbound entity_position_sync packet framing and dispatch/decode for one primitive PositionMoveRotation fixture only; do not infer initialized Entity/Level behavior, entity existence, spawn readiness, render readiness, or client-load completion."
}
