{
  "case_id": "play_disconnect_clientbound_framed_dispatch",
  "protocol_version": 775,
  "minecraft_version": "26.1.2",
  "corridor": "Configuration -> Play",
  "oracle_kind": "codec",
  "official_sources": [
    {
      "role": "client_jar",
      "path": "_analysis/minecraft-26.1.2/client.jar",
      "function_or_member": "net.minecraft.network.chat.Component.literal(String)",
      "authority_note": "Official binary source for constructing the disconnect Component fixture."
    },
    {
      "role": "client_jar",
      "path": "_analysis/minecraft-26.1.2/client.jar",
      "function_or_member": "net.minecraft.network.protocol.common.ClientboundDisconnectPacket(Component)",
      "authority_note": "Official binary source for constructing the Play clientbound disconnect packet fixture."
    },
    {
      "role": "client_jar",
      "path": "_analysis/minecraft-26.1.2/client.jar",
      "function_or_member": "net.minecraft.network.protocol.common.ClientboundDisconnectPacket.STREAM_CODEC",
      "authority_note": "Official binary source for the disconnect packet body codec."
    },
    {
      "role": "client_jar",
      "path": "_analysis/minecraft-26.1.2/client.jar",
      "function_or_member": "net.minecraft.network.protocol.game.GameProtocols.CLIENTBOUND_TEMPLATE.details().listPackets(...)",
      "authority_note": "Official binary source for the Play clientbound packet table and disconnect packet id."
    },
    {
      "role": "client_jar",
      "path": "_analysis/minecraft-26.1.2/client.jar",
      "function_or_member": "net.minecraft.network.protocol.game.GameProtocols.CLIENTBOUND_TEMPLATE.bind(RegistryFriendlyByteBuf.decorator(RegistryAccess.EMPTY)).codec().encode/decode(ClientboundDisconnectPacket)",
      "authority_note": "Official binary source for Play clientbound disconnect framed packet encode and dispatch/decode."
    }
  ],
  "question": {
    "state": "Play",
    "flow": "Clientbound",
    "packet_type": "minecraft:disconnect",
    "packet_class": "ClientboundDisconnectPacket",
    "input_fields": {
      "reason": ""
    },
    "field_notes": {
      "reason": "Empty literal Component fixture matching prior disconnect packet-support surfaces; does not exercise UI disconnect flow."
    }
  },
  "answer_path": "oracle/answers/775/play_disconnect_clientbound_framed_dispatch.answer.jsonl",
  "stop_boundary": "Proves Play clientbound disconnect packet framing and dispatch/decode for one empty literal Component reason fixture only; do not infer UI disconnect handling, screen flow, runtime Play entry, world load, spawn readiness, render readiness, or client-load completion."
}
