{
  "case_id": "play_store_cookie_clientbound_framed_dispatch",
  "protocol_version": 775,
  "minecraft_version": "26.1.2",
  "corridor": "Play",
  "oracle_kind": "codec",
  "official_sources": [
    {
      "role": "client_jar",
      "path": "_analysis/minecraft-26.1.2/client.jar",
      "function_or_member": "Identifier.parse(String); ClientboundStoreCookiePacket(Identifier, byte[]); ClientboundStoreCookiePacket.STREAM_CODEC; ClientboundStoreCookiePacket.PAYLOAD_STREAM_CODEC",
      "authority_note": "Official binary source for store_cookie key and payload body encoding."
    },
    {
      "role": "client_jar",
      "path": "_analysis/minecraft-26.1.2/client.jar",
      "function_or_member": "GameProtocols.CLIENTBOUND_TEMPLATE.details().listPackets(...)",
      "authority_note": "Official binary source for the Play clientbound packet table and store_cookie packet id."
    }
  ],
  "question": {
    "state": "Play",
    "flow": "Clientbound",
    "packet_type": "minecraft:store_cookie",
    "packet_class": "ClientboundStoreCookiePacket",
    "input_fields": {
      "key": "rustmine:test_cookie",
      "payload_hex": "00112233aaff"
    },
    "field_notes": {
      "payload": "Primitive byte-array fixture under the official 5120-byte limit."
    }
  },
  "answer_path": "oracle/answers/775/play_store_cookie_clientbound_framed_dispatch.answer.jsonl",
  "stop_boundary": "Proves Play clientbound store_cookie packet framing and dispatch/decode for one key/payload fixture only; does not infer runtime cookie storage policy."
}
