{
  "case_id": "play_container_set_content_clientbound_framed_dispatch",
  "protocol_version": 775,
  "minecraft_version": "26.1.2",
  "corridor": "Configuration -> Play",
  "oracle_kind": "codec",
  "official_sources": [
    {
      "role": "client_jar",
      "path": "_analysis/minecraft-26.1.2/client.jar",
      "function_or_member": "net.minecraft.network.protocol.game.GameProtocols.CLIENTBOUND_TEMPLATE.details().listPackets(...)",
      "authority_note": "Official binary source for the Play clientbound packet table and the container_set_content packet id."
    },
    {
      "role": "client_jar",
      "path": "_analysis/minecraft-26.1.2/client.jar",
      "function_or_member": "ClientboundContainerSetContentPacket(int, int, List<ItemStack>, ItemStack), ClientboundContainerSetContentPacket.STREAM_CODEC, ByteBufCodecs.CONTAINER_ID, ByteBufCodecs.VAR_INT, ItemStack.OPTIONAL_LIST_STREAM_CODEC, ItemStack.OPTIONAL_STREAM_CODEC",
      "authority_note": "Official binary source for constructing, writing, reading, and observing the container_set_content body."
    },
    {
      "role": "client_jar",
      "path": "_analysis/minecraft-26.1.2/client.jar",
      "function_or_member": "net.minecraft.network.protocol.game.GameProtocols.CLIENTBOUND_TEMPLATE.bind(RegistryFriendlyByteBuf.decorator(RegistryAccess.EMPTY)).codec().encode/decode(...)",
      "authority_note": "Official binary source for writing and dispatch-decoding the full Play clientbound container_set_content frame."
    }
  ],
  "question": {
    "state": "Play",
    "flow": "Clientbound",
    "packet_type": "minecraft:container_set_content",
    "packet_class": "ClientboundContainerSetContentPacket",
    "input_fields": {
      "container_id": 7,
      "state_id": 123,
      "items": [],
      "carried_item": "ItemStack.EMPTY"
    },
    "field_notes": {
      "container_id": "Uses the official ByteBufCodecs.CONTAINER_ID surface with a small non-zero container id.",
      "state_id": "Uses the official ByteBufCodecs.VAR_INT surface with a small non-zero state id.",
      "items": "Uses the official empty List<ItemStack> fixture, so no item registry entry or component payload is required.",
      "carried_item": "Uses the official ItemStack.EMPTY fixture, so ItemStack.OPTIONAL_STREAM_CODEC emits the empty-stack marker without an item registry entry or component payload."
    }
  },
  "answer_path": "oracle/answers/775/play_container_set_content_clientbound_framed_dispatch.answer.jsonl",
  "stop_boundary": "Proves Play clientbound container_set_content packet framing and dispatch/decode for one official empty-items and empty-carried-stack fixture only; do not infer non-empty ItemStack/component registry handling, menu lifecycle behavior, inventory state, initialized game state, runtime Play entry, world load, render readiness, or client-load completion."
}
