{
  "case_id": "play_set_experience_clientbound_framed_dispatch",
  "protocol_version": 775,
  "minecraft_version": "26.1.2",
  "corridor": "Configuration -> Play",
  "oracle_kind": "codec",
  "official_sources": [
    {
      "role": "client_jar",
      "path": "_analysis/minecraft-26.1.2/client.jar",
      "function_or_member": "ClientboundSetExperiencePacket(float, int, int)",
      "authority_note": "Official binary source for constructing the Play clientbound set_experience fixture."
    },
    {
      "role": "client_jar",
      "path": "_analysis/minecraft-26.1.2/client.jar",
      "function_or_member": "ClientboundSetExperiencePacket.STREAM_CODEC; FriendlyByteBuf.readFloat/writeFloat; FriendlyByteBuf.readVarInt/writeVarInt",
      "authority_note": "Official binary source for progress, level, and total experience body codec."
    },
    {
      "role": "client_jar",
      "path": "_analysis/minecraft-26.1.2/client.jar",
      "function_or_member": "GameProtocols.CLIENTBOUND_TEMPLATE.details().listPackets(...)",
      "authority_note": "Official binary source for the Play clientbound packet table and set_experience packet id."
    }
  ],
  "question": {
    "state": "Play",
    "flow": "Clientbound",
    "packet_type": "minecraft:set_experience",
    "packet_class": "ClientboundSetExperiencePacket",
    "input_fields": {
      "experience_progress": 0.625,
      "total_experience": 9876,
      "experience_level": 42
    },
    "field_notes": {
      "experience_progress": "Primitive progress fixture; does not prove player XP state.",
      "experience_level": "Constructor third argument; official body writes this value before total experience.",
      "total_experience": "Constructor second argument; official body writes this value after level."
    }
  },
  "answer_path": "oracle/answers/775/play_set_experience_clientbound_framed_dispatch.answer.jsonl",
  "stop_boundary": "Proves Play clientbound set_experience packet framing and dispatch/decode for one primitive progress/level/total fixture only; do not infer player XP state, UI behavior, or client-load completion."
}
