{
  "case_id": "login_disconnect_clientbound_framed_dispatch",
  "protocol_version": 775,
  "minecraft_version": "26.1.2",
  "corridor": "Handshake -> Login -> Configuration",
  "oracle_kind": "codec",
  "official_sources": [
    {
      "role": "client_jar",
      "path": "_analysis/minecraft-26.1.2/client.jar",
      "function_or_member": "net.minecraft.network.chat.Component.literal(String)",
      "authority_note": "Official binary source for constructing the smallest named literal Component fixture used as the Login disconnect reason."
    },
    {
      "role": "client_jar",
      "path": "_analysis/minecraft-26.1.2/client.jar",
      "function_or_member": "net.minecraft.network.protocol.login.ClientboundLoginDisconnectPacket(Component)",
      "authority_note": "Official binary source for constructing a Login clientbound login_disconnect packet fixture."
    },
    {
      "role": "client_jar",
      "path": "_analysis/minecraft-26.1.2/client.jar",
      "function_or_member": "net.minecraft.network.protocol.login.ClientboundLoginDisconnectPacket.STREAM_CODEC.encode(...)",
      "authority_note": "Official binary source for Login clientbound login_disconnect body encoding."
    },
    {
      "role": "client_jar",
      "path": "_analysis/minecraft-26.1.2/client.jar",
      "function_or_member": "net.minecraft.network.protocol.login.LoginProtocols.CLIENTBOUND.codec().encode(ClientboundLoginDisconnectPacket)",
      "authority_note": "Official binary source for Login clientbound login_disconnect framed packet encoding."
    },
    {
      "role": "client_jar",
      "path": "_analysis/minecraft-26.1.2/client.jar",
      "function_or_member": "net.minecraft.network.protocol.login.LoginProtocols.CLIENTBOUND.codec().decode(...)",
      "authority_note": "Official binary source for Login clientbound login_disconnect framed packet dispatch/decode."
    },
    {
      "role": "client_jar",
      "path": "_analysis/minecraft-26.1.2/client.jar",
      "function_or_member": "net.minecraft.network.protocol.login.LoginProtocols.CLIENTBOUND_TEMPLATE.details().listPackets(...)",
      "authority_note": "Official binary source for the Login clientbound packet table."
    },
    {
      "role": "client_jar",
      "path": "_analysis/minecraft-26.1.2/client.jar",
      "function_or_member": "ClientboundLoginDisconnectPacket.reason(), Component.getString(), ClientLoginPacketListener extends ClientCookiePacketListener",
      "authority_note": "Official binary source for reading decoded login_disconnect reason fields and confirming the Login listener clientbound surface."
    }
  ],
  "question": {
    "state": "Login",
    "flow": "Clientbound",
    "packet_type": "minecraft:login_disconnect",
    "packet_class": "ClientboundLoginDisconnectPacket",
    "input_fields": {
      "reason_text": ""
    },
    "field_notes": {
      "reason_text": "The fixture is Component.literal(\"\"): an empty literal component accepted by the official ClientboundLoginDisconnectPacket.STREAM_CODEC. The generated answer owns the resulting bytes."
    }
  },
  "answer_path": "oracle/answers/775/login_disconnect_clientbound_framed_dispatch.answer.jsonl",
  "stop_boundary": "Proves Login clientbound login_disconnect packet framing and dispatch/decode for one official empty literal Component reason fixture only; do not infer UI disconnect handling, screen flow, authentication failure handling, Configuration entry, Play readiness, or client-load completion."
}
