{
  "case_id": "play_update_mob_effect_clientbound_framed_dispatch",
  "protocol_version": 775,
  "minecraft_version": "26.1.2",
  "corridor": "Play -> Spawn -> Move -> Interact",
  "oracle_kind": "codec",
  "official_sources": [
    {
      "role": "client_jar",
      "path": "_analysis/minecraft-26.1.2/client.jar",
      "function_or_member": "net.minecraft.network.protocol.game.ClientboundUpdateMobEffectPacket(int, MobEffectInstance, boolean)",
      "authority_note": "Official binary source for constructing the Play clientbound update_mob_effect fixture."
    },
    {
      "role": "client_jar",
      "path": "_analysis/minecraft-26.1.2/client.jar",
      "function_or_member": "net.minecraft.world.effect.MobEffects.SPEED; net.minecraft.world.effect.MobEffect.STREAM_CODEC; net.minecraft.network.codec.ByteBufCodecs.holderRegistry",
      "authority_note": "Official binary source for the bounded MobEffect holder fixture and registry-holder network encoding."
    },
    {
      "role": "client_jar",
      "path": "_analysis/minecraft-26.1.2/client.jar",
      "function_or_member": "net.minecraft.world.effect.MobEffectInstance(Holder<MobEffect>, int, int, boolean, boolean, boolean)",
      "authority_note": "Official binary source for amplifier, duration, visibility, icon, and ambient flag derivation."
    }
  ],
  "question": {
    "state": "Play",
    "flow": "Clientbound",
    "packet_type": "minecraft:update_mob_effect",
    "packet_class": "ClientboundUpdateMobEffectPacket",
    "input_fields": {
      "fixture": "ClientboundUpdateMobEffectPacket(12345, new MobEffectInstance(MobEffects.SPEED, 200, 1, false, true, true), false)"
    },
    "field_notes": {
      "fixture": "Bounded official MobEffectInstance fixture for packet bytes; entity id is primitive packet input, not proof of entity/effect runtime state."
    }
  },
  "answer_path": "oracle/answers/775/play_update_mob_effect_clientbound_framed_dispatch.answer.jsonl",
  "stop_boundary": "Proves one Play clientbound update_mob_effect framed dispatch/decode fixture only; do not infer arbitrary MobEffect registry ids, entity existence, effect application, particles, HUD behavior, or runtime state."
}
