{
  "case_id": "configuration_resource_pack_pop_clientbound_framed_dispatch",
  "protocol_version": 775,
  "minecraft_version": "26.1.2",
  "corridor": "Login -> Configuration -> Play",
  "oracle_kind": "codec",
  "official_sources": [
    {
      "role": "client_jar",
      "path": "_analysis/minecraft-26.1.2/client.jar",
      "function_or_member": "net.minecraft.network.protocol.common.ClientboundResourcePackPopPacket(Optional<UUID>)",
      "authority_note": "Official binary source for constructing the Configuration clientbound resource_pack_pop packet fixture."
    },
    {
      "role": "client_jar",
      "path": "_analysis/minecraft-26.1.2/client.jar",
      "function_or_member": "net.minecraft.network.protocol.common.ClientboundResourcePackPopPacket.STREAM_CODEC",
      "authority_note": "Official binary source for Configuration clientbound resource_pack_pop body encoding and decoding."
    },
    {
      "role": "client_jar",
      "path": "_analysis/minecraft-26.1.2/client.jar",
      "function_or_member": "net.minecraft.network.protocol.configuration.ConfigurationProtocols.CLIENTBOUND.codec().encode(ClientboundResourcePackPopPacket)",
      "authority_note": "Official binary source for Configuration clientbound resource_pack_pop framed packet encoding."
    },
    {
      "role": "client_jar",
      "path": "_analysis/minecraft-26.1.2/client.jar",
      "function_or_member": "net.minecraft.network.protocol.configuration.ConfigurationProtocols.CLIENTBOUND.codec().decode(...)",
      "authority_note": "Official binary source for Configuration clientbound resource_pack_pop framed packet dispatch/decode."
    },
    {
      "role": "client_jar",
      "path": "_analysis/minecraft-26.1.2/client.jar",
      "function_or_member": "net.minecraft.network.protocol.configuration.ConfigurationProtocols.CLIENTBOUND_TEMPLATE.details().listPackets(...)",
      "authority_note": "Official binary source for the Configuration clientbound packet table."
    },
    {
      "role": "client_jar",
      "path": "_analysis/minecraft-26.1.2/client.jar",
      "function_or_member": "net.minecraft.network.protocol.common.ClientboundResourcePackPopPacket.id()",
      "authority_note": "Official binary source for reading decoded resource_pack_pop optional UUID."
    }
  ],
  "question": {
    "state": "Configuration",
    "flow": "Clientbound",
    "packet_type": "minecraft:resource_pack_pop",
    "packet_class": "ClientboundResourcePackPopPacket",
    "input_fields": {
      "id": "123e4567-e89b-12d3-a456-426614174000"
    },
    "field_notes": {
      "id": "The fixture uses Optional.of(UUID) to prove the official optional UUID body shape without proving resource-pack UI, removal policy, download, reload, or prompt behavior."
    }
  },
  "answer_path": "oracle/answers/775/configuration_resource_pack_pop_clientbound_framed_dispatch.answer.jsonl",
  "stop_boundary": "Proves Configuration clientbound resource_pack_pop packet framing and dispatch/decode for one official present-UUID fixture only; do not infer resource-pack UI behavior, pack removal policy, download/reload behavior, Configuration completion, Play entry, world load, render readiness, or runtime behavior."
}
