{
  "case_id": "play_chunk_batch_finished_clientbound_framed_dispatch",
  "protocol_version": 775,
  "minecraft_version": "26.1.2",
  "corridor": "Configuration -> Play",
  "oracle_kind": "codec",
  "official_sources": [
    {
      "role": "client_jar",
      "path": "_analysis/minecraft-26.1.2/client.jar",
      "function_or_member": "net.minecraft.network.protocol.game.GameProtocols.CLIENTBOUND_TEMPLATE.details().listPackets(...)",
      "authority_note": "Official binary source for the Play clientbound packet table and the chunk_batch_finished packet id."
    },
    {
      "role": "client_jar",
      "path": "_analysis/minecraft-26.1.2/client.jar",
      "function_or_member": "ClientboundChunkBatchFinishedPacket(int), ClientboundChunkBatchFinishedPacket.STREAM_CODEC",
      "authority_note": "Official binary source for constructing, decoding, and writing the chunk_batch_finished body without initialized game state."
    },
    {
      "role": "client_jar",
      "path": "_analysis/minecraft-26.1.2/client.jar",
      "function_or_member": "private ClientboundChunkBatchFinishedPacket(FriendlyByteBuf), private write(FriendlyByteBuf), FriendlyByteBuf.readVarInt/writeVarInt",
      "authority_note": "Official binary source for the batchSize body shape."
    },
    {
      "role": "client_jar",
      "path": "_analysis/minecraft-26.1.2/client.jar",
      "function_or_member": "net.minecraft.network.protocol.game.GameProtocols.CLIENTBOUND_TEMPLATE.bind(RegistryFriendlyByteBuf.decorator(RegistryAccess.EMPTY)).codec().encode/decode(...)",
      "authority_note": "Official binary source for writing and dispatch-decoding the full Play clientbound chunk_batch_finished frame."
    }
  ],
  "question": {
    "state": "Play",
    "flow": "Clientbound",
    "packet_type": "minecraft:chunk_batch_finished",
    "packet_class": "ClientboundChunkBatchFinishedPacket",
    "input_fields": {
      "batch_size": 7
    },
    "field_notes": {
      "fixture": "Uses official ClientboundChunkBatchFinishedPacket(int). The fixture is a context-free record constructor and does not require an initialized Level, chunk storage, or game state."
    }
  },
  "answer_path": "oracle/answers/775/play_chunk_batch_finished_clientbound_framed_dispatch.answer.jsonl",
  "stop_boundary": "Proves Play clientbound chunk_batch_finished packet framing and dispatch/decode for one official batchSize fixture only; do not infer chunk batch pacing behavior, chunk-load completion, initialized game state, spawn readiness, world load, render readiness, or client-load completion."
}
