{
  "case_id": "play_set_player_team_clientbound_framed_dispatch",
  "protocol_version": 775,
  "minecraft_version": "26.1.2",
  "corridor": "Play",
  "oracle_kind": "codec",
  "official_sources": [
    {
      "role": "client_jar",
      "path": "_analysis/minecraft-26.1.2/client.jar",
      "function_or_member": "ClientboundSetPlayerTeamPacket.createRemovePacket(PlayerTeam), ClientboundSetPlayerTeamPacket.write/STREAM_CODEC",
      "authority_note": "Official binary source for the remove-only set_player_team body."
    },
    {
      "role": "client_jar",
      "path": "_analysis/minecraft-26.1.2/client.jar",
      "function_or_member": "GameProtocols.CLIENTBOUND_TEMPLATE.details().listPackets(...)",
      "authority_note": "Official binary source for the Play clientbound packet table and set_player_team packet id."
    }
  ],
  "question": {
    "state": "Play",
    "flow": "Clientbound",
    "packet_type": "minecraft:set_player_team",
    "packet_class": "ClientboundSetPlayerTeamPacket",
    "input_fields": {
      "team_name": "rustmine_team",
      "method": "remove"
    },
    "field_notes": {
      "scope": "Remove method only; official write branch omits parameters and player list."
    }
  },
  "answer_path": "oracle/answers/775/play_set_player_team_clientbound_framed_dispatch.answer.jsonl",
  "stop_boundary": "Proves Play clientbound set_player_team packet framing and dispatch/decode for one remove fixture only; does not infer team lifecycle, parameters, colors, visibility, collision, player memberships, or scoreboard UI behavior."
}
