{
  "case_id": "configuration_transfer_clientbound_framed_dispatch",
  "protocol_version": 775,
  "minecraft_version": "26.1.2",
  "corridor": "Login -> Configuration -> Play",
  "oracle_kind": "codec",
  "official_sources": [
    {
      "role": "client_jar",
      "path": "_analysis/minecraft-26.1.2/client.jar",
      "function_or_member": "net.minecraft.network.protocol.common.ClientboundTransferPacket(String, int)",
      "authority_note": "Official binary source for constructing the Configuration clientbound transfer packet fixture."
    },
    {
      "role": "client_jar",
      "path": "_analysis/minecraft-26.1.2/client.jar",
      "function_or_member": "net.minecraft.network.protocol.common.ClientboundTransferPacket.STREAM_CODEC",
      "authority_note": "Official binary source for Configuration clientbound transfer body encoding and decoding."
    },
    {
      "role": "client_jar",
      "path": "_analysis/minecraft-26.1.2/client.jar",
      "function_or_member": "net.minecraft.network.protocol.configuration.ConfigurationProtocols.CLIENTBOUND.codec().encode(ClientboundTransferPacket)",
      "authority_note": "Official binary source for Configuration clientbound transfer framed packet encoding."
    },
    {
      "role": "client_jar",
      "path": "_analysis/minecraft-26.1.2/client.jar",
      "function_or_member": "net.minecraft.network.protocol.configuration.ConfigurationProtocols.CLIENTBOUND.codec().decode(...)",
      "authority_note": "Official binary source for Configuration clientbound transfer framed packet dispatch/decode."
    },
    {
      "role": "client_jar",
      "path": "_analysis/minecraft-26.1.2/client.jar",
      "function_or_member": "net.minecraft.network.protocol.configuration.ConfigurationProtocols.CLIENTBOUND_TEMPLATE.details().listPackets(...)",
      "authority_note": "Official binary source for the Configuration clientbound packet table."
    },
    {
      "role": "client_jar",
      "path": "_analysis/minecraft-26.1.2/client.jar",
      "function_or_member": "net.minecraft.network.protocol.common.ClientboundTransferPacket.host(), port()",
      "authority_note": "Official binary source for reading decoded transfer fields."
    }
  ],
  "question": {
    "state": "Configuration",
    "flow": "Clientbound",
    "packet_type": "minecraft:transfer",
    "packet_class": "ClientboundTransferPacket",
    "input_fields": {
      "host": "transfer.rustmine.local",
      "port": 25566
    },
    "field_notes": {
      "host": "Explicit non-runtime fixture host for packet-support proof.",
      "port": "Explicit non-default fixture port encoded by the official VarInt port field."
    }
  },
  "answer_path": "oracle/answers/775/configuration_transfer_clientbound_framed_dispatch.answer.jsonl",
  "stop_boundary": "Proves Configuration clientbound transfer packet framing and dispatch/decode for one official host/port fixture only; do not infer server transfer UX, reconnect behavior, network reconnection, Configuration completion, Play entry, world load, render readiness, or runtime behavior."
}
